ID,car_name,review,rating
110,ford Mustang,"I shopped competitive convertibles: Jag FType, Audi S5, BMW M4. They are really nice cars with alot of character and potentially some challenging maintenance issues. The Mustang in my opinion is the best value by far. Gobs of power, great looks, excellent build quality and not overwhleming in the techy world of a BMW or a Audi. The Jag might have a better looking interior- but it also does not have a trunk, nor does the BMW. Key feature of the Mustang is the desing of the roof and the fact that I can fit 2 sets of golf bags in trunk with roof down. Not giant staff bags, but 2 sets of carry stand bags leaving the drivers in the bag! It is perfect.",3
112,ford Fusion,"Before this car, I had a 2012 Fusion, and it felt like everyone wanted to set their stuff on the deck lid or place their biscuits on the hood while waiting for me—thanks, Ford, for making that a little less achievable! I really like the new fuel door; it's a much better design than the capless system on my old model, which never sealed properly. The headlights also seem easier to replace, and the engine compartment has a decent amount of space to work in if I plan to keep it long-term. The computer is in the engine bay, which feels a bit cringe, but it's far enough from the engine that I don't think it'll be a problem. The battery is partially under the rain gutter, but it looks easy to slide out when it needs replacing. The suspension is great, as always, and this car stops on a dime! The trunk is cavernous—you could probably fit 2-4 people back there! The back seat is comfortable, with sufficient legroom unless a tall person is sitting up front. The only downside is the floor mats; generic ones don’t fit at all, so I need to find good ones and keep them forever.",3
113,ford Ranger,"I really really wanted to buy a Tacoma but my test drive was unimpressive. I found the Ford ranger to be much more responsive and smooth. The inside was also more comfortable although I did buy the lariat trim. The only negative is that so far the city mileage is about 18mpg. My first highway trip was 28 mpg, however so that was cool. I’ve been so impressed with the ranger, way beyond my expectations.",3
118,toyota Corolla,"I wanted a car that was cheap to own and fun to drive, and after having numerous Camaro SS models with the manual transmission, I found that this car, while lacking the monster torque and horsepower, still maintains the fun factor. The new chassis on the Corolla is excellent, offering just the right handling—soft but not too cushy, with good manners when driven. It has decent corner entry and, if you're in the right gear, a sweet corner exit. The interior surprised me; it’s much better than I expected, and I love the moonroof! I wouldn't even consider this car without a manual and the 2.0L engine. It's a great package for the money. The Miata felt overpriced for what it is, and the Civic seems weak to me. As an old hotrodder and road racer, I really enjoy this car as a daily driver. My only gripe is that the B-pillar between the front and rear door makes getting in and out a bit of a pain; my Camaro was easier to enter because the rear seat was about a foot behind the driver seat. Love it!",3
119,toyota RAV4,"I recently bought a 2022 Sienna and a RAV4 hybrid at the same time with my wife. While I find the Sienna very comfortable, the RAV4 is a different story. At 5'11"" and 240 pounds, I struggle with the cramped legroom caused by the 12-inch wide center console—it makes my legs feel confined. In contrast, the Sienna offers much more lateral space, measuring 24 inches between the console and door handle compared to 21 inches in the RAV4. My wife, who's 5'1"", is comfortable in the RAV4, but I recommend trying it out before purchasing, especially if you're taller. Both vehicles come with decent features, but the Sienna's console design, with extra drink holders and phone slots, definitely wins in practicality. The RAV4 hybrid has good acceleration and integrates well with Apple CarPlay, but I struggled to get the Toyota Scout GPS app working.",3
120,toyota Yaris,"I’m really happy I chose the Yaris over the Chevy Sonic after owning it for a month. The interior feels high-quality for a subcompact, even if the center console is a bit flimsy. The controls are straightforward, and the center display screen is easy to use. It’s super fun to drive—definitely not slow! With 106 hp and weighing just over 2400 lbs, it feels zippy, almost like a Miata sedan. Plus, the sound system is impressive, on par with my '03 Lexus, and I’m averaging 43 mpg. I recommend going for the manual transmission, though it took me a bit to find a comfy driving position since I'm taller. Overall, I couldn’t be happier!",3
123,toyota C-HR,Love it great features and great looks,4
124,toyota Prius,This is the third prius that we have owned,3
129,toyota Land Cruiser,Great vehicle which will outlast just about anything on the market. Only drawback is that is thirsty!,3
130,toyota Supra,"I bought the 2021 3.0 Premium without even test driving it, drawn in by its stunning silver look. I considered a new Corvette, but the pricing was crazy. I got this fully loaded model for $57k, and wow, it’s fast—faster than my Mustang Boss 302! It’s underrated at 382 hp, but I’d say it’s closer to 410. The transmission is excellent; the sport mode shifts better than a manual unless you're really into shifting yourself. My only complaint is the silly horn that sounds like Peewee Herman's bike horn. The interior is comfy and nice, although getting in takes a bit of flexibility for taller folks. The handling in turns is amazing, the differential provides great traction, and it’s just a blast to drive. Definitely take it for a test ride—you’ll see what you’re missing. It’s a real head-turner, and the day I drove it home was a great surprise!",3
131,toyota Camry,I live this car. It is comfortable to ride in - both front seats and back. There is very little road noise. Although I have the smaller engine it has plenty HP for what I need from a daily driver. Pano moon roof is a nice feature. The JBL stereo system is nice. As of now I have no complaints at all.,3
